<?xml version="1.0" encoding="UTF-8"?>
<!DOCTYPE wccs SYSTEM "data.dtd">

<!-- Author: Kenny Cason -->
<!-- Email: kenneth.cason AT gmail DOT com -->
<!-- Website: www.kennycason.com -->
<!-- Date: 2008 Nov 1 -->

<!-- Logical OR -->
<traindata>
  <innodes>2</innodes>
  <midlayers>1</midlayers>
  <midnodes>2</midnodes>
  <outnodes>1</outnodes>
  <learnrate>10.5</learnrate>
  <maxcycles>100000</maxcycles>
  <error>.0001</error>
  <numdata>4</numdata>
  <data>
    <in>0</in>
    <in>0</in>
    <out>0</out>
  </data>
  <data>
    <in>0</in>
    <in>1</in>
    <out>1</out>
  </data>
  <data>
    <in>1</in>
    <in>0</in>
    <out>1</out>
  </data>
  <data>
    <in>1</in>
    <in>1</in>
    <out>1</out>
  </data>
</traindata>